{
  "schemaVersion": 1,
  "name": "NGIN.Workspace",
  "defaultTarget": "NGIN.CoreSample",
  "targets": [
    {
      "name": "NGIN.CoreSample",
      "type": "Runtime",
      "profile": "ConsoleApp",
      "platform": "linux-x64",
      "enableReflection": false,
      "packages": [
        {
          "name": "NGIN.Core",
          "versionRange": ">=0.1.0 <0.2.0",
          "optional": false
        },
        {
          "name": "NGIN.ECS",
          "versionRange": ">=0.1.0 <0.2.0",
          "optional": false
        }
      ],
      "modules": {
        "enable": [
          "Core.Hosting",
          "Domain.ECS"
        ],
        "disable": []
      },
      "plugins": {
        "enable": [],
        "disable": []
      },
      "environmentName": "Dev",
      "configSources": [],
      "workingDirectory": "."
    },
    {
      "name": "NGIN.EditorSample",
      "type": "Editor",
      "profile": "Editor",
      "platform": "linux-x64",
      "enableReflection": true,
      "packages": [
        {
          "name": "NGIN.Core",
          "versionRange": ">=0.1.0 <0.2.0",
          "optional": false
        },
        {
          "name": "NGIN.ECS",
          "versionRange": ">=0.1.0 <0.2.0",
          "optional": false
        },
        {
          "name": "NGIN.Editor",
          "versionRange": ">=0.1.0 <0.2.0",
          "optional": false
        },
        {
          "name": "NGIN.Reflection",
          "versionRange": ">=0.1.0 <0.2.0",
          "optional": false
        },
        {
          "name": "NGIN.Diagnostics",
          "versionRange": ">=0.1.0 <0.2.0",
          "optional": false
        }
      ],
      "modules": {
        "enable": [
          "Core.Hosting",
          "Domain.ECS",
          "Editor.Workspace"
        ],
        "disable": []
      },
      "plugins": {
        "enable": [
          "NGIN.Diagnostics"
        ],
        "disable": []
      },
      "environmentName": "Dev",
      "configSources": [],
      "workingDirectory": "."
    },
    {
      "name": "NGIN.ProgramSync",
      "type": "Program",
      "profile": "ConsoleApp",
      "platform": "linux-x64",
      "enableReflection": false,
      "packages": [
        {
          "name": "NGIN.Benchmark",
          "versionRange": ">=0.1.0 <0.2.0",
          "optional": false
        }
      ],
      "modules": {
        "enable": [
          "App.SyncProgram"
        ],
        "disable": []
      },
      "plugins": {
        "enable": [],
        "disable": []
      },
      "environmentName": "Dev",
      "configSources": [],
      "workingDirectory": "."
    },
    {
      "name": "NGIN.DevShell",
      "type": "Developer",
      "profile": "TestHost",
      "platform": "linux-x64",
      "enableReflection": true,
      "packages": [
        {
          "name": "NGIN.Benchmark",
          "versionRange": ">=0.1.0 <0.2.0",
          "optional": false
        },
        {
          "name": "NGIN.Reflection",
          "versionRange": ">=0.1.0 <0.2.0",
          "optional": false
        },
        {
          "name": "NGIN.Diagnostics",
          "versionRange": ">=0.1.0 <0.2.0",
          "optional": false
        }
      ],
      "modules": {
        "enable": [
          "App.BenchmarkTool"
        ],
        "disable": []
      },
      "plugins": {
        "enable": [
          "NGIN.Diagnostics"
        ],
        "disable": []
      },
      "environmentName": "Dev",
      "configSources": [],
      "workingDirectory": "."
    }
  ]
}
